title,company_name,company_link
Java Engineer,PT Nusa Satu Inti Artha (DOKU),Link is not available
Junior Fullstack PHP Programmer,The Big Rich Group,Link is not available
Front End Developer – Internship,MarkPlus,Link is not available
Front End Developer - Gramedia Digital,Kompas Gramedia,Link is not available
Application Developer,PT Bank Central Asia Tbk,https://id.indeed.com//cmp/PT-Bank-Central-Asia-Tbk
PHP Developer,PT ULIROTIO MAHAKARYA TEKNOLOGI (URTIMATE),Link is not available
Web Developer,Sindo News,Link is not available
Full-stack Developer (Work from Home; Full-time),Dynamic Technology Lab Pte Ltd,Link is not available
Web & Content Developer,PT. Prodata Sistem Teknologi,Link is not available
Back End Developer,PT Mega Utama Development,Link is not available
Software Quality Assurance Intern,Shopee,https://id.indeed.com//cmp/Shopee
IT Developer,Marsindo Konsult Prima,Link is not available
Front End Developer,PT Mega Utama Development,Link is not available
Web Developer,Providence Group,Link is not available
Internship Program : Software Engineer,Mekari (PT. Mid Solusi Nusantara),Link is not available
